<?xml version='1.0' encoding='utf-8'?>
<!DOCTYPE list SYSTEM "moveroute.dtd">
<list>
	<moveroute name="anta01" type="LOOP" is_running="true">
		<node x="144588" y="114415" z="-3712" />
		<node x="145028" y="113964" z="-3720" />
		<node x="145565" y="112796" z="-3720" />
		<node x="147292" y="112298" z="-3720" />
		<node x="148870" y="112879" z="-3720" />
		<node x="149289" y="114446" z="-3720" />
		<node x="148699" y="115797" z="-3720" />
		<node x="147622" y="116455" z="-3696" />
		<node x="146089" y="116189" z="-3720" />
		<node x="145478" y="115466" z="-3720" />
	</moveroute>
	<moveroute name="anta02" type="LOOP" is_running="true">
		<node x="147121" y="116447" z="-3704" />
		<node x="145821" y="116127" z="-3720" />
		<node x="145068" y="115317" z="-3720" />
		<node x="145179" y="114573" z="-3720" />
		<node x="145000" y="113473" z="-3720" />
		<node x="145932" y="112608" z="-3720" />
		<node x="146666" y="112633" z="-3720" />
		<node x="147091" y="112393" z="-3720" />
		<node x="148426" y="111834" z="-3720" />
		<node x="149058" y="112739" z="-3720" />
		<node x="149142" y="114352" z="-3720" />
		<node x="149043" y="115349" z="-3720" />
		<node x="148261" y="116040" z="-3720" />
	</moveroute>
	<moveroute name="anta03" type="LOOP" is_running="true">
		<node x="149046" y="115713" z="-3704" />
		<node x="148057" y="116273" z="-3720" />
		<node x="146962" y="116166" z="-3720" />
		<node x="146389" y="116343" z="-3720" />
		<node x="145427" y="115092" z="-3720" />
		<node x="145046" y="115063" z="-3720" />
		<node x="144970" y="114122" z="-3720" />
		<node x="145268" y="113186" z="-3720" />
		<node x="145917" y="112638" z="-3720" />
		<node x="147622" y="112236" z="-3720" />
		<node x="148443" y="111807" z="-3720" />
		<node x="149182" y="113166" z="-3720" />
		<node x="149326" y="114798" z="-3720" />
	</moveroute>
	<moveroute name="anta04" type="LOOP" is_running="true">
		<node x="148969" y="112462" z="-3720" />
		<node x="149307" y="114122" z="-3720" />
		<node x="149288" y="115027" z="-3720" />
		<node x="149201" y="115569" z="-3704" />
		<node x="147999" y="116333" z="-3720" />
		<node x="147147" y="116334" z="-3712" />
		<node x="146400" y="116303" z="-3720" />
		<node x="145724" y="116099" z="-3720" />
		<node x="145416" y="115539" z="-3720" />
		<node x="144759" y="115017" z="-3720" />
		<node x="145048" y="114051" z="-3720" />
		<node x="145052" y="113345" z="-3720" />
		<node x="145946" y="112652" z="-3720" />
		<node x="146742" y="112671" z="-3720" />
		<node x="147298" y="112206" z="-3720" />
		<node x="148285" y="111836" z="-3720" />
		<node x="148868" y="112217" z="-3720" />
	</moveroute>
	<moveroute name="anta05" type="LOOP" is_running="true">
		<node x="146396" y="112467" z="-3720" />
		<node x="147275" y="112366" z="-3720" />
		<node x="148404" y="111708" z="-3720" />
		<node x="149011" y="112200" z="-3720" />
		<node x="148978" y="112976" z="-3720" />
		<node x="149389" y="114042" z="-3720" />
		<node x="149190" y="115059" z="-3720" />
		<node x="148757" y="115760" z="-3720" />
		<node x="148243" y="115972" z="-3720" />
		<node x="147309" y="116338" z="-3704" />
		<node x="146711" y="116448" z="-3720" />
		<node x="146132" y="116125" z="-3720" />
		<node x="145514" y="115844" z="-3720" />
		<node x="144996" y="114996" z="-3720" />
		<node x="144919" y="114193" z="-3720" />
		<node x="145296" y="113303" z="-3720" />
		<node x="145900" y="112548" z="-3720" />
	</moveroute>
	<moveroute name="anta06" type="LOOP" is_running="true">
		<node x="145243" y="115607" z="-3720" />
		<node x="144847" y="115093" z="-3720" />
		<node x="144861" y="114199" z="-3720" />
		<node x="145144" y="113171" z="-3720" />
		<node x="145911" y="112548" z="-3720" />
		<node x="146522" y="112680" z="-3720" />
		<node x="147183" y="112253" z="-3720" />
		<node x="148265" y="111844" z="-3720" />
		<node x="148866" y="112217" z="-3720" />
		<node x="149181" y="113493" z="-3720" />
		<node x="149235" y="115266" z="-3720" />
		<node x="148119" y="116207" z="-3720" />
		<node x="146757" y="116484" z="-3712" />
		<node x="145609" y="115952" z="-3720" />
	</moveroute>
	<moveroute name="anta07" type="LOOP" is_running="true">
		<node x="147470" y="112233" z="-3720" />
		<node x="148062" y="112676" z="-3720" />
		<node x="148825" y="112787" z="-3720" />
		<node x="149111" y="114411" z="-3720" />
		<node x="149144" y="115414" z="-3720" />
		<node x="147399" y="116543" z="-3696" />
		<node x="146176" y="116041" z="-3720" />
		<node x="144933" y="115060" z="-3720" />
		<node x="145177" y="113945" z="-3720" />
		<node x="145195" y="113291" z="-3720" />
		<node x="146235" y="112582" z="-3720" />
		<node x="147183" y="112277" z="-3720" />
	</moveroute>
	<moveroute name="anta08" type="LOOP" is_running="true">
		<node x="148061" y="115909" z="-3720" />
		<node x="147307" y="116433" z="-3704" />
		<node x="146655" y="116399" z="-3720" />
		<node x="146032" y="115995" z="-3720" />
		<node x="145633" y="116057" z="-3720" />
		<node x="144925" y="115154" z="-3720" />
		<node x="144808" y="114123" z="-3720" />
		<node x="145036" y="113883" z="-3720" />
		<node x="145096" y="113268" z="-3720" />
		<node x="145787" y="112631" z="-3720" />
		<node x="146682" y="112832" z="-3720" />
		<node x="147141" y="112184" z="-3720" />
		<node x="148343" y="111922" z="-3720" />
		<node x="149016" y="112619" z="-3720" />
		<node x="149372" y="114234" z="-3720" />
		<node x="149286" y="115316" z="-3720" />
		<node x="148599" y="115938" z="-3720" />
	</moveroute>
	<moveroute name="anta09" type="LOOP" is_running="true">
		<node x="149090" y="114015" z="-3720" />
		<node x="149261" y="115199" z="-3720" />
		<node x="148620" y="116040" z="-3720" />
		<node x="147396" y="116408" z="-3704" />
		<node x="146526" y="116372" z="-3720" />
		<node x="145452" y="115861" z="-3720" />
		<node x="144951" y="115161" z="-3720" />
		<node x="145011" y="113841" z="-3720" />
		<node x="145332" y="113052" z="-3720" />
		<node x="146005" y="112544" z="-3720" />
		<node x="146795" y="112506" z="-3720" />
		<node x="148371" y="111951" z="-3720" />
		<node x="149008" y="112730" z="-3720" />
		<node x="149184" y="113764" z="-3720" />
	</moveroute>
</list>